"603131","248687","289631","2164896","32","26388951","24000040","2024-01-05 18:04:03","49.25014","-84.49983","2024-01-05 19:12:53","realtypress",NULL,NULL,NULL,NULL,NULL,NULL,"Cash Crop, Hobby Farm",NULL,NULL,"0.00",NULL,NULL,NULL,NULL,NULL,NULL,NULL,NULL,"FROM INTERSECTION OF ROAD 38 AND HIGHWAY 19, Head south on Road 38 toward Easy St, Turn right onto Sand Rd, destination will be on your right. Property can be viewed from baseball diamond",NULL,NULL,NULL,NULL,NULL,"Freehold",NULL,NULL,NULL,NULL,"2000000.00",NULL,NULL,"Agriculture","ATTENTION DEVELOPERS, 48.48 ACRES OF FARMLAND BACKING ON TO VANLUVEN LAKE WITH 913.36 ft LAKE FRONTAGE. FALLING WITHIN THE URBAN GROWTH BOUNDARY, AND ADJOINING MLS 22009250 THIS PROPERTY MAKES AN IDEAL LOCATION FOR FUTURE RESIDENTIAL DEVELOPMENT. INCLUDES 4.94 ACRES OF ENVIRONMENTALLY PROTECTED WETLAND ON SOUTH SIDE OF VERONA SAND RD. SEE SUPPLEMENTS FOR URBAN GROWTH BOUNDARY MAP. *OUTLINES IN PHOTOS ARE APPROXIMATE PROPERTY BOUNDARIES* (id:50029)",NULL,NULL,NULL,NULL,"None",NULL,"For sale",NULL,NULL,NULL,NULL,NULL,"A1",NULL,"https://www.realtor.ca/real-estate/26388951/pt-lt-10-11-con-11-portland-not-available",NULL,NULL,NULL,NULL,NULL,NULL,"0",NULL,NULL,"0",NULL,NULL,NULL,NULL,NULL,NULL,NULL,NULL,NULL,NULL,NULL,NULL,NULL,NULL,NULL,NULL,NULL,NULL,NULL,NULL,NULL,NULL,"False",NULL,NULL,NULL,NULL,NULL,NULL,NULL,NULL,NULL,NULL,NULL,NULL,NULL,NULL,NULL,NULL,NULL,NULL,NULL,NULL,NULL,NULL,"53.38 ac|10+ acres","53.38 ac|10+ acres",NULL,NULL,"true",NULL,NULL,NULL,NULL,NULL,NULL,NULL,NULL,NULL,NULL,"Unknown",NULL,"53.38",NULL,NULL,NULL,NULL,NULL,"PT LT 10-11 CON 11 Portland","PT LT 10-11 CON 11 Portland",NULL,"PT LT 10-1","CON 11 Portland",NULL,NULL,NULL,"not available","Ontario","K0H2W0","Canada",NULL,NULL,NULL,NULL,"[]","[]","[]","[]","{""VideoLink"":""https:\/\/www.youtube.com\/watch?v=PxtaqFR_lf0&feature=youtu.be""}","0","0"
"658660","24542","272344","1397926,1397339","34","25485090","23006202","2024-01-16 19:07:58","42.23276","-83.03056","2024-01-16 19:32:28","realtypress",NULL,NULL,NULL,NULL,NULL,NULL,NULL,NULL,NULL,"0.00",NULL,NULL,NULL,NULL,NULL,NULL,NULL,NULL,NULL,NULL,NULL,NULL,NULL,NULL,"Freehold",NULL,NULL,NULL,NULL,"150000.00",NULL,NULL,"Vacant Land","FUTURE RESIDENTIAL BUILDING LOTS. 5 LOTS OF 30 FT FRONTAGE, CLOSE TO MALDEN RD. PROPERTY TO BE VERIFIED BY BUYER FOR ALL SERVICES AND ANY OTHER RESTRICTIONS FOR DEVELOPMENT FROM THE CITY. (id:50029)",NULL,NULL,NULL,NULL,NULL,NULL,"For sale",NULL,NULL,NULL,NULL,NULL,"AGRICULTUR",NULL,"https://www.realtor.ca/real-estate/25485090/vl-millwood-avenue-lasalle",NULL,NULL,NULL,NULL,NULL,NULL,"0",NULL,NULL,"0",NULL,NULL,NULL,NULL,NULL,NULL,NULL,NULL,NULL,NULL,NULL,NULL,NULL,NULL,NULL,NULL,NULL,NULL,NULL,NULL,NULL,NULL,"False",NULL,NULL,NULL,NULL,NULL,NULL,NULL,NULL,NULL,NULL,NULL,NULL,NULL,NULL,NULL,NULL,NULL,NULL,NULL,NULL,NULL,NULL,NULL,"150 FT X 100 FT",NULL,NULL,"false",NULL,NULL,NULL,NULL,NULL,NULL,NULL,NULL,NULL,NULL,"See remarks",NULL,"150 FT X 100 FT",NULL,NULL,NULL,NULL,NULL,"V/L MILLWOOD AVENUE","V/L MILLWOOD AVENUE",NULL,"V/L","MILLWOOD","Avenue",NULL,NULL,"lasalle","Ontario","N9H1X8","Canada",NULL,NULL,NULL,NULL,"[]","[]","[]","[]","[]","0","0"
"663653","147853","48685","1397526","34","13914118","1311858","2024-01-17 16:06:33","42.3098068","-82.9370499","2024-01-17 17:17:33","ddf",NULL,NULL,NULL,NULL,NULL,NULL,NULL,NULL,NULL,"30.00",NULL,"square feet",NULL,NULL,NULL,NULL,NULL,NULL,NULL,NULL,NULL,NULL,NULL,NULL,NULL,NULL,NULL,NULL,NULL,"0.00",NULL,NULL,"Industrial","NEW BUILD! OCCUPANCY SPRING 2021. WILL DESIGN TO SUIT. UNITS FROM 1200 SQ FT TO 10000 SQ FT AVAILABLE. SHADOW ANCHORED BY ZEHRS/WINNERS. OTHER PAD SITES AVAILABLE! (id:50029)",NULL,NULL,NULL,NULL,NULL,NULL,"For lease",NULL,NULL,NULL,NULL,NULL,"COMM",NULL,"https://www.realtor.ca/real-estate/13914118/2651-lauzon-parkway-unit-4-windsor","Restaurant","Restaurant",NULL,NULL,NULL,NULL,"0",NULL,NULL,"0",NULL,NULL,NULL,NULL,NULL,NULL,NULL,NULL,NULL,NULL,NULL,NULL,"2003",NULL,NULL,NULL,NULL,NULL,"Air Conditioned",NULL,"Unknown",NULL,"False",NULL,NULL,NULL,NULL,NULL,NULL,NULL,"Forced air",NULL,NULL,NULL,NULL,NULL,"10900.0000",NULL,NULL,"10900 sqft",NULL,NULL,NULL,"Municipal water",NULL,NULL,"1000X",NULL,NULL,"false",NULL,NULL,NULL,NULL,NULL,NULL,NULL,NULL,NULL,NULL,NULL,NULL,"1000X",NULL,NULL,NULL,NULL,NULL,"2651 LAUZON PARKWAY Unit# 4","2651 LAUZON PARKWAY Unit# 4",NULL,"2651","LAUZON","Parkway",NULL,"4","windsor","Ontario","N8T1C5","Canada",NULL,NULL,NULL,NULL,"[]","[]","[]","[]","[]","0","0"
"663878","147979","48685","1397526","34","11689645","1003319","2024-01-17 16:06:34","42.1078835","-83.1091156","2024-01-17 17:19:20","ddf",NULL,NULL,NULL,NULL,NULL,NULL,NULL,NULL,NULL,"30.00",NULL,"square feet",NULL,NULL,NULL,NULL,NULL,NULL,NULL,NULL,NULL,NULL,NULL,NULL,NULL,NULL,NULL,NULL,NULL,"0.00",NULL,NULL,"Industrial","SOBEY'S RETAIL CENTRE HAS AN OPPORTUNITY FOR MULTIPLE SIZED NEW PADS, TO BE BUILT. NEW BUILDS FROM 1000 SQ FT TO 9,000 SQ FT. DOWNTOWN AMHERSTBURG LOCATION, ACROSS FROM HIGH SCHOOL. (id:50029)",NULL,NULL,NULL,NULL,NULL,NULL,"For lease",NULL,NULL,NULL,NULL,NULL,"CD1",NULL,"https://www.realtor.ca/real-estate/11689645/83-sandwich-amherstburg",NULL,NULL,NULL,NULL,NULL,NULL,"0",NULL,NULL,"0",NULL,NULL,NULL,NULL,NULL,NULL,NULL,NULL,NULL,NULL,NULL,NULL,NULL,NULL,NULL,NULL,NULL,NULL,"Air Conditioned",NULL,NULL,NULL,"False",NULL,NULL,NULL,NULL,NULL,NULL,NULL,"Forced air, Heat Recovery Ventilation (HRV)",NULL,NULL,NULL,NULL,NULL,"9000.0000",NULL,NULL,"9000 sqft",NULL,NULL,NULL,"Municipal water",NULL,NULL,"75000 SQ FT",NULL,NULL,"false",NULL,NULL,NULL,NULL,NULL,NULL,NULL,NULL,NULL,NULL,NULL,NULL,"75000 SQ FT",NULL,NULL,NULL,NULL,NULL,"83 SANDWICH","83 SANDWICH",NULL,"83","SANDWICH",NULL,NULL,NULL,"amherstburg","Ontario","N9V1Z5","Canada",NULL,NULL,NULL,NULL,"[]","[]","[]","[]","[]","0","0"
"664060","148061","48685","1397526","34","4143136","0513269","2024-01-17 16:06:35","42.317337","-83.0393219","2024-01-17 17:21:06","ddf",NULL,NULL,NULL,NULL,NULL,NULL,NULL,NULL,NULL,"12.00",NULL,"square feet",NULL,NULL,NULL,NULL,NULL,NULL,NULL,NULL,NULL,NULL,NULL,NULL,NULL,NULL,NULL,NULL,NULL,"0.00",NULL,NULL,"Industrial","HIGH PROFILE BLDG IN DOWNTOWN WINDSOR. GROUND FLR RETAIL AVAIL FROM 1500-5000 SQ' PLUS 4000 SQ' FINISHED BSMT OFFICE SPACE FROM 5000 SQ' PER FLR. 3 FLRS AVAIL. MINIMUM SPACE TO LEASE 1000 SQ', MAX 20,000 SQ'. LEASE A FLR & GET BLDG SIGNAGE! (id:50029)",NULL,NULL,NULL,NULL,NULL,NULL,"For lease",NULL,NULL,NULL,NULL,NULL,"COMM",NULL,"https://www.realtor.ca/real-estate/4143136/301-ouellette-windsor",NULL,NULL,NULL,NULL,NULL,NULL,"0",NULL,NULL,"0",NULL,NULL,NULL,NULL,NULL,NULL,NULL,NULL,NULL,NULL,NULL,NULL,NULL,NULL,NULL,NULL,NULL,NULL,"Air Conditioned",NULL,"Full Sprinkler System",NULL,"False",NULL,NULL,NULL,NULL,NULL,NULL,NULL,"Baseboard heaters, Forced air",NULL,NULL,NULL,NULL,NULL,"15000.0000",NULL,NULL,"15000 sqft",NULL,NULL,NULL,"Municipal water",NULL,NULL,NULL,NULL,NULL,"false",NULL,NULL,NULL,NULL,NULL,NULL,NULL,NULL,NULL,NULL,NULL,NULL,NULL,NULL,NULL,NULL,NULL,NULL,"301 OUELLETTE","301 OUELLETTE",NULL,"301","OUELLETTE",NULL,NULL,NULL,"windsor","Ontario","N9A4J4","Canada",NULL,NULL,NULL,NULL,"[]","[]","[]","[]","[]","0","0"
"664180","148240","48685","1397526","34","12829511","1301396","2024-01-17 16:06:34","42.3194656","-83.0397873","2024-01-17 17:22:06","ddf",NULL,NULL,NULL,NULL,NULL,NULL,NULL,NULL,NULL,"15.00",NULL,"square feet",NULL,NULL,NULL,NULL,NULL,NULL,NULL,NULL,NULL,NULL,NULL,NULL,NULL,NULL,NULL,NULL,NULL,"0.00",NULL,NULL,"Industrial","PRIME DOWNTOWN WINDSOR LOCATION. 'CIBC BANK' BLDG ON THE CORNER OF OUELLETTE & RIVERSIDE DR. INCREDIBLE WATER & CITY VIEWS OF DETROIT SKYLINE & CITY CENTRE. JOIN THE MANY OTHER PRESTIGIOUS TENANTS AT VERY AFFORDABLE RATES. IF YOU EVER WANTED TO MOVE TO 100 OUELLETTE AVENUE, NOW IS YOUR OPPORTUNITY. UNITS RANGING FROM 1100 SQ FT TO 40,000 SQ FT. PRKG ALSO AVAILABLE ON A LIMITED BASIS. www.mikhailholdings.com. (id:50029)",NULL,NULL,NULL,NULL,NULL,NULL,"For lease",NULL,NULL,NULL,NULL,NULL,"COMM",NULL,"https://www.realtor.ca/real-estate/12829511/100-ouellette-windsor",NULL,NULL,NULL,NULL,NULL,NULL,"0",NULL,NULL,"0",NULL,NULL,NULL,NULL,NULL,NULL,NULL,NULL,NULL,NULL,NULL,NULL,"1988",NULL,NULL,NULL,NULL,NULL,"Air Conditioned",NULL,"Partial Sprinkler System",NULL,"False",NULL,NULL,NULL,NULL,NULL,NULL,NULL,"Forced air, Heat Recovery Ventilation (HRV)",NULL,NULL,NULL,NULL,NULL,"40000.0000",NULL,NULL,"40000 sqft",NULL,NULL,NULL,"Municipal water",NULL,NULL,"120,000 SQ FT",NULL,NULL,"false",NULL,NULL,NULL,NULL,NULL,NULL,NULL,NULL,NULL,NULL,NULL,NULL,"120,000 SQ FT",NULL,NULL,NULL,NULL,NULL,"100 OUELLETTE","100 OUELLETTE",NULL,"100","OUELLETTE",NULL,NULL,NULL,"windsor","Ontario","N9A6T3","Canada",NULL,NULL,NULL,NULL,"[]","[]","[]","[]","[]","0","0"
"709143","184330","285842","1678523","34","26296756","23023446","2024-01-25 21:06:03","42.02919","-82.92049","2024-01-25 21:16:32","realtypress",NULL,NULL,NULL,NULL,NULL,NULL,NULL,NULL,NULL,"0.00",NULL,NULL,NULL,NULL,NULL,NULL,NULL,NULL,NULL,NULL,NULL,NULL,NULL,NULL,"Freehold",NULL,NULL,NULL,NULL,"1451761.00",NULL,NULL,"Vacant Land","FOR SALE: 7.277 ACRES SERVICED INDUSTRIAL LAND ($199,500/acre) in the COLLAVINO BUSINESS PARK, Harrow, ON. Multiple sites, smaller acreages available at $244,500/acre. Water, storm, sewer located along Loricon Crescent & gas, hydro, telephone, internet located along Roseborough. Will build to suit. Call L/B for details. (id:50029)",NULL,NULL,NULL,NULL,NULL,NULL,"For sale",NULL,NULL,NULL,NULL,NULL,"M2.1",NULL,"https://www.realtor.ca/real-estate/26296756/vl-loricon-crescent-harrow",NULL,NULL,NULL,NULL,NULL,NULL,"0",NULL,NULL,"0",NULL,NULL,NULL,NULL,NULL,NULL,NULL,NULL,NULL,NULL,NULL,NULL,NULL,NULL,NULL,NULL,NULL,NULL,NULL,NULL,NULL,NULL,"False",NULL,NULL,NULL,NULL,NULL,NULL,NULL,NULL,NULL,NULL,NULL,NULL,NULL,NULL,NULL,NULL,NULL,NULL,NULL,NULL,NULL,NULL,NULL,"7.277 ACRES",NULL,NULL,"false",NULL,NULL,NULL,NULL,NULL,NULL,NULL,NULL,NULL,NULL,"See remarks",NULL,"7.277 ACRES",NULL,NULL,NULL,NULL,NULL,"V/L LORICON CRESCENT","V/L LORICON CRESCENT",NULL,"V/L","LORICON","Crescent",NULL,NULL,"harrow","Ontario","N0R1G0","Canada",NULL,NULL,NULL,NULL,"[]","[]","[]","[]","{""VideoLink"":""https:\/\/www.dropbox.com\/scl\/fi\/9pv4z57vnudhnndni2x2d\/Collavino-Business-Park_2023b.mp4?rlkey=sq75lv4g5p4t92vpky2zloz4j&dl=0""}","0","0"
"709144","184331","285842","1678523","34","26296755","23023447","2024-01-25 21:06:03","42.02919","-82.92049","2024-01-25 21:16:32","realtypress",NULL,NULL,NULL,NULL,NULL,NULL,NULL,NULL,NULL,"0.00",NULL,NULL,NULL,NULL,NULL,NULL,NULL,NULL,NULL,NULL,NULL,NULL,NULL,NULL,"Freehold",NULL,NULL,NULL,NULL,"1898043.00",NULL,NULL,"Vacant Land","FOR SALE: 9.514 ACRES SERVICED INDUSTRIAL LAND ($199,500/acre) in the COLLAVINO BUSINESS PARK, Harrow, ON. Multiple sites, smaller acreages available at $224,500/acre. Water, storm, sewer located along Loricon Crescent & gas, hydro, telephone, internet located along Roseborough. Will build to suit. Call L/B for details. (id:50029)",NULL,NULL,NULL,NULL,NULL,NULL,"For sale",NULL,NULL,NULL,NULL,NULL,"M2.1",NULL,"https://www.realtor.ca/real-estate/26296755/vl-loricon-crescent-harrow",NULL,NULL,NULL,NULL,NULL,NULL,"0",NULL,NULL,"0",NULL,NULL,NULL,NULL,NULL,NULL,NULL,NULL,NULL,NULL,NULL,NULL,NULL,NULL,NULL,NULL,NULL,NULL,NULL,NULL,NULL,NULL,"False",NULL,NULL,NULL,NULL,NULL,NULL,NULL,NULL,NULL,NULL,NULL,NULL,NULL,NULL,NULL,NULL,NULL,NULL,NULL,NULL,NULL,NULL,NULL,"9.514 ACRES",NULL,NULL,"false",NULL,NULL,NULL,NULL,NULL,NULL,NULL,NULL,NULL,NULL,"See remarks",NULL,"9.514 ACRES",NULL,NULL,NULL,NULL,NULL,"V/L LORICON CRESCENT","V/L LORICON CRESCENT",NULL,"V/L","LORICON","Crescent",NULL,NULL,"harrow","Ontario","N0R1G0","Canada",NULL,NULL,NULL,NULL,"[]","[]","[]","[]","{""VideoLink"":""https:\/\/www.dropbox.com\/scl\/fi\/9pv4z57vnudhnndni2x2d\/Collavino-Business-Park_2023b.mp4?rlkey=sq75lv4g5p4t92vpky2zloz4j&dl=0""}","0","0"
"738079","112232","48613","1396934","32","25173425","23000394","2024-01-31 15:02:31","42.4034042","-82.1846619","2024-01-31 15:15:12","ddf",NULL,NULL,NULL,NULL,NULL,NULL,NULL,NULL,NULL,"20.00",NULL,"square feet",NULL,NULL,NULL,NULL,NULL,NULL,"Downtown across from Bus Depot",NULL,NULL,NULL,NULL,NULL,"Leasehold",NULL,NULL,NULL,NULL,"0.00",NULL,NULL,"Industrial","Second floor suite for lease - approx. 700 sq ft. (gross) ready to move in immediately $20.00 sq ft is all inclusive. (water, hydro ,taxes, building insurance, common maintenance.) Central Downtown Chatham Executive office building. Ample designated and municipal parking. Elevator and Handicap accessible. (id:50029)",NULL,NULL,NULL,NULL,NULL,NULL,"For lease",NULL,NULL,NULL,NULL,NULL,"UC(CBD)",NULL,"https://www.realtor.ca/real-estate/25173425/40-centre-street-chatham",NULL,NULL,NULL,NULL,NULL,NULL,"0",NULL,NULL,"0",NULL,NULL,NULL,NULL,NULL,NULL,NULL,NULL,NULL,NULL,NULL,NULL,"1976",NULL,NULL,NULL,NULL,NULL,NULL,NULL,NULL,NULL,"False",NULL,NULL,NULL,NULL,NULL,NULL,NULL,NULL,NULL,NULL,NULL,NULL,"300 sqft","300 sqft",NULL,NULL,"300 sqft",NULL,NULL,NULL,NULL,NULL,NULL,"0X",NULL,NULL,"false",NULL,NULL,NULL,NULL,NULL,NULL,NULL,NULL,NULL,NULL,NULL,NULL,"0X",NULL,NULL,NULL,NULL,NULL,"40 Centre STREET","40 Centre STREET",NULL,"40","Centre","Street",NULL,NULL,"chatham","Ontario","N7M5W3","Canada",NULL,NULL,NULL,NULL,"[]","[]","[]","[]","[]","0","0"
"768640","298480","48713","2017220","34","26479938","24001980","2024-02-05 18:05:52","42.30008","-83.01654","2024-02-05 18:17:20","realtypress",NULL,NULL,NULL,NULL,NULL,NULL,NULL,NULL,NULL,"0.00",NULL,NULL,NULL,NULL,NULL,NULL,NULL,NULL,NULL,NULL,NULL,NULL,NULL,NULL,"Freehold",NULL,NULL,NULL,NULL,"219000.00",NULL,NULL,"Vacant Land","FUTURE RESIDENTIAL BUILDING LOT 150FT X 105FT IN PRIME SOUTH WINDSOR LOCATION, CLOSE TO UNIVERSITY OF WINDSOR, HIGHWAYS,US BORDER, BRIDGE, SHOPPING, SCHOOLS AND MOSQUE. PROPERTY TO BE VERIFIED BY BUYER FOR ALL SERVICES AND ANY OTHER RESTRICTION FOR DEVELOPMENT FROM THE CITY OF WINDSOR. (id:50029)",NULL,NULL,NULL,NULL,NULL,NULL,"For sale",NULL,NULL,NULL,NULL,NULL,"PD.1",NULL,"https://www.realtor.ca/real-estate/26479938/vl-st-clair-avenue-windsor",NULL,NULL,NULL,NULL,NULL,NULL,"0",NULL,NULL,"0",NULL,NULL,NULL,NULL,NULL,NULL,NULL,NULL,NULL,NULL,NULL,NULL,NULL,NULL,NULL,NULL,NULL,NULL,NULL,NULL,NULL,NULL,"False",NULL,NULL,NULL,NULL,NULL,NULL,NULL,NULL,NULL,NULL,NULL,NULL,NULL,NULL,NULL,NULL,NULL,NULL,NULL,NULL,NULL,NULL,NULL,"150 FT 105 FT",NULL,NULL,"false",NULL,NULL,NULL,NULL,NULL,NULL,NULL,NULL,NULL,NULL,"See remarks",NULL,"150 FT 105 FT",NULL,NULL,NULL,NULL,NULL,"V/L ST. CLAIR AVENUE","V/L ST. CLAIR AVENUE",NULL,"V/L","ST. CLAIR","Avenue",NULL,NULL,"windsor","Ontario","A0A0A0","Canada",NULL,NULL,NULL,NULL,"[]","[]","[]","[]","[]","0","0"
"781366","263128","79972","2136408","35","26414256","2114812","2024-02-07 17:25:57","46.5454445","-80.8884888","2024-02-07 18:13:38","ddf","Airport",NULL,"Quiet Area",NULL,NULL,NULL,NULL,NULL,NULL,"0.00",NULL,NULL,NULL,NULL,NULL,NULL,NULL,NULL,NULL,NULL,NULL,NULL,NULL,NULL,"Freehold",NULL,NULL,NULL,NULL,"59900.00",NULL,NULL,"Vacant Land","If youre seeking peace and tranquility but dont want to travel outside of town, this 40 acre parcel offers the opportunity to go off-the-grid without leaving the city. Uncleared and undisturbed, this land provides the outdoor enthusiast with a true off-grid experience. Whether youre an avid hunter, camper, snow-shoer, or just someone looking to spend more time outside, this property is an excellent place to embrace the northern lifestyle and soak in all the beauty that Northern Ontario has to offer. Please note that the property is likely to be accessed by foot or off-road vehicle, as there is no public road leading directly to the property. For more information, please contact the listing agent or your realtor. (Please do not access the property before speaking to the listing agent or your realtor.) (id:50029)",NULL,NULL,"No thru road",NULL,NULL,NULL,"For sale",NULL,NULL,NULL,NULL,NULL,"RU, M4",NULL,"https://www.realtor.ca/real-estate/26414256/con-2-lot-7-pcl-48092-falconbridge",NULL,NULL,NULL,NULL,NULL,NULL,"0",NULL,NULL,"0",NULL,NULL,NULL,NULL,NULL,NULL,NULL,NULL,NULL,NULL,NULL,NULL,NULL,NULL,NULL,NULL,NULL,NULL,NULL,NULL,NULL,NULL,"False",NULL,NULL,NULL,NULL,NULL,NULL,NULL,NULL,NULL,NULL,NULL,NULL,NULL,NULL,NULL,NULL,NULL,NULL,NULL,NULL,"None",NULL,NULL,"1,367 X 1334.33|10 - 50 acres",NULL,"Unknown","true","Airport",NULL,NULL,NULL,NULL,"Not fenced",NULL,NULL,NULL,NULL,NULL,NULL,"1,367 X 1334.33",NULL,"Unknown",NULL,NULL,NULL,"Con 2 Lot 7 PCL 48092","Con 2 Lot 7 PCL 48092",NULL,NULL,NULL,NULL,NULL,NULL,"falconbridge","Ontario","P3L1E8","Canada",NULL,NULL,NULL,NULL,"[]","{""Name"":""None""}","[]","[]","[]","0","0"
"786572","147864","48685","1397526","34","11689647","1003318","2024-02-08 15:06:21","42.0965691","-83.1099854","2024-02-08 16:13:43","ddf",NULL,NULL,NULL,NULL,NULL,NULL,NULL,NULL,NULL,"23.00",NULL,"square feet",NULL,NULL,NULL,NULL,NULL,NULL,NULL,NULL,NULL,NULL,NULL,NULL,NULL,NULL,NULL,NULL,NULL,"0.00",NULL,NULL,"Industrial","WALMART/LCBO SITE HAS VACANT SOURCE STORE SITE AVAILABLE. 3,000 SQ FT. JOIN A THRIVING RETAIL PLAZA WITH THE DRAW OF WAL-MART, A NEW LCBO STORE, FITNESS CENTER AND MUCH, MUCH MORE. (id:50029)",NULL,NULL,NULL,NULL,NULL,NULL,"For lease",NULL,NULL,NULL,NULL,NULL,"CD1",NULL,"https://www.realtor.ca/real-estate/11689647/400-sandwich-amherstburg",NULL,NULL,NULL,NULL,NULL,NULL,"0",NULL,NULL,"0",NULL,NULL,NULL,NULL,NULL,NULL,NULL,NULL,NULL,NULL,NULL,NULL,"2008",NULL,NULL,NULL,NULL,NULL,"Air Conditioned",NULL,"Partial Sprinkler System",NULL,"False",NULL,NULL,NULL,NULL,NULL,NULL,NULL,"Forced air, Heat Recovery Ventilation (HRV)",NULL,NULL,NULL,NULL,NULL,"3000.0000",NULL,NULL,"3000 sqft",NULL,NULL,NULL,"Municipal water",NULL,NULL,"220000 SQ FT",NULL,NULL,"false",NULL,NULL,NULL,NULL,NULL,NULL,NULL,NULL,NULL,NULL,NULL,NULL,"220000 SQ FT",NULL,NULL,NULL,NULL,NULL,"400 SANDWICH","400 SANDWICH",NULL,"400","SANDWICH",NULL,NULL,NULL,"amherstburg","Ontario","N9V3L4","Canada",NULL,NULL,NULL,NULL,"[]","[]","[]","[]","[]","0","0"
"807422","320198","87589","1433215","91","26530369","TB240304","2024-02-20 17:21:43","46.62972","-84.52083","2024-02-20 21:28:26","realtypress",NULL,NULL,NULL,NULL,NULL,NULL,NULL,NULL,NULL,"0.00",NULL,NULL,NULL,NULL,NULL,"2024-02-17",NULL,NULL,"Turn right on Hwy 628 - property on right-hand side between Hwy 11/17 & Cantley Drive.",NULL,NULL,NULL,NULL,NULL,NULL,NULL,NULL,NULL,NULL,"99900.00",NULL,NULL,"Vacant Land","12.5 acres in a good location in Red Rock. Close to the Trans Canada Highway. Fronting on Cantley Drive + backing onto Hwy 11/17 (id:50029)",NULL,NULL,NULL,NULL,NULL,NULL,"For sale",NULL,NULL,NULL,NULL,NULL,NULL,NULL,"https://www.realtor.ca/real-estate/26530369/w-12-lt-5-cantley-drive-red-rock-red-rock",NULL,NULL,NULL,NULL,NULL,NULL,"0",NULL,NULL,"0",NULL,NULL,NULL,NULL,NULL,NULL,NULL,NULL,NULL,NULL,NULL,NULL,NULL,NULL,NULL,NULL,NULL,NULL,NULL,NULL,NULL,NULL,"False",NULL,NULL,NULL,NULL,NULL,NULL,NULL,NULL,NULL,NULL,NULL,NULL,NULL,NULL,NULL,NULL,NULL,NULL,NULL,NULL,"None",NULL,"12.5 ac|10 - 49.99 acres","12.5 ac|10 - 49.99 acres","362.0000","Road access","true",NULL,NULL,NULL,NULL,NULL,NULL,NULL,NULL,NULL,NULL,"No sewage system",NULL,"12.5",NULL,NULL,NULL,NULL,NULL,"W 1/2 Lt 5 Cantley Drive","W 1/2 Lt 5 Cantley Drive",NULL,NULL,NULL,NULL,NULL,NULL,"red rock","Ontario","P0T2P0","Canada",NULL,"Red Rock",NULL,NULL,"[]","[]","[]","[]","[]","0","0"
"810028","27438","284572","1987890","91","25166865","TB230027","2024-02-13 06:18:22","48.7213973004078","-94.5516404698364","2024-02-20 21:39:24","ddf",NULL,"High Speed Internet",NULL,NULL,NULL,NULL,NULL,NULL,NULL,"0.00",NULL,NULL,NULL,NULL,NULL,"2023-01-06",NULL,NULL,"TURN OFF ATWOOD/HWY 11 ONTO TOWER RD, DRIVE NEXT BLOCK TO ALICE ST AND TURN RIGHT AND DRIVE TO SIGN.",NULL,NULL,NULL,NULL,NULL,NULL,NULL,NULL,NULL,NULL,"24900.00",NULL,NULL,"Vacant Land","Looking for a larger than normal, 132' x 132' building lot? This parcel is located within the town limits with town services in a very quiet area with only a couple neighbors! All town amenities are blocks away, including school, hospital, businesses and main dock and snowmobile trail. Go for a drive and check it out! (id:50029)",NULL,NULL,NULL,NULL,NULL,NULL,"For sale",NULL,NULL,NULL,NULL,NULL,NULL,NULL,"https://www.realtor.ca/real-estate/25166865/709-alice-st-rainy-river-rainy-river",NULL,NULL,NULL,NULL,NULL,NULL,"0",NULL,NULL,"0",NULL,NULL,NULL,NULL,NULL,NULL,NULL,NULL,NULL,NULL,NULL,NULL,NULL,NULL,NULL,NULL,NULL,NULL,NULL,NULL,NULL,NULL,"False",NULL,NULL,NULL,NULL,NULL,NULL,NULL,NULL,NULL,NULL,NULL,NULL,NULL,NULL,NULL,NULL,NULL,NULL,NULL,NULL,"Municipal water",NULL,NULL,"under 1/2 acre","132.0000","Road access","false",NULL,NULL,NULL,NULL,NULL,NULL,NULL,NULL,NULL,NULL,"Municipal sewage system","132 ft",NULL,NULL,NULL,NULL,NULL,NULL,"709 ALICE ST","709 ALICE ST",NULL,NULL,NULL,NULL,NULL,NULL,"rainy river","Ontario","P0W1L0","Canada",NULL,"RAINY RIVER",NULL,NULL,"{""Utility"":[{""Type"":""Electricity"",""Description"":""Available""},{""Type"":""Natural Gas"",""Description"":""Available""},{""Type"":""Telephone"",""Description"":""Available""}]}","[]","[]","[]","[]","0","0"
"810959","237865","284572","2130267","91","26374521","TB233623","2024-02-13 06:19:13","49.8056","-93.30999","2024-02-20 21:42:40","realtypress",NULL,NULL,NULL,NULL,NULL,NULL,NULL,NULL,NULL,"0.00",NULL,NULL,NULL,NULL,NULL,"2023-12-22",NULL,NULL,"HEAD SOUTH DOWN WALDHOF ROAD OFF HWY 17 TO BEAVER TRAIL ROAD",NULL,NULL,NULL,NULL,NULL,NULL,NULL,NULL,NULL,NULL,"1300000.00",NULL,NULL,"Other","Welcome to Bear Trail Resort, a purpose-built fishing retreat on the tranquil shores of Eagle Lake. With multiple cabins and a charming lakeside setting, this expansive property, spanning 52 acres, invites you to script a new chapter as a fishing resort or realize your unique vision. Imagine enhancing Bear Trail into a classic fishing retreat, where the lure of angling blends seamlessly with the serene beauty of Eagle Lake. Alternatively, explore the potential of cultivating this space into a thriving business, leveraging the lasting charm, and the opportunity for a fresh start. Whether you're drawn to the timeless appeal of a fishing resort or envision a new business venture by Eagle Lake, Bear Trail Resort welcomes you to shape its next chapter. Seize the opportunity to breathe fresh life into this welcoming spot, creating your version of an ideal fishing haven or laying the foundation for an exciting journey ahead. (id:50029)",NULL,NULL,NULL,NULL,NULL,NULL,"For sale",NULL,NULL,"Waterfront","EAGLE LAKE",NULL,NULL,NULL,"https://www.realtor.ca/real-estate/26374521/215-bear-trail-lodge-vermillion-bay-vermillion-bay",NULL,NULL,NULL,NULL,NULL,NULL,"0",NULL,NULL,"0",NULL,NULL,NULL,NULL,NULL,NULL,NULL,NULL,NULL,NULL,NULL,NULL,NULL,NULL,NULL,NULL,NULL,NULL,NULL,NULL,NULL,NULL,"False",NULL,NULL,NULL,NULL,NULL,NULL,NULL,NULL,NULL,NULL,NULL,NULL,NULL,NULL,NULL,NULL,NULL,NULL,NULL,NULL,NULL,NULL,"52 ac|51 - 100 acres","52 ac|51 - 100 acres","839.0000",NULL,"true",NULL,NULL,NULL,NULL,NULL,NULL,NULL,NULL,NULL,NULL,NULL,NULL,"52",NULL,NULL,NULL,NULL,NULL,"215 BEAR TRAIL LODGE","215 BEAR TRAIL LODGE",NULL,NULL,NULL,NULL,NULL,NULL,"vermillion bay","Ontario","P0V2V0","Canada",NULL,"VERMILLION BAY",NULL,NULL,"[]","[]","[]","[]","{""VideoLink"":""https:\/\/youtu.be\/8s3GfgFuBJA""}","0","0"
"811021","32984","61534","1468453","91","23748605","TB213098","2024-02-13 04:23:56","49.7954979","-92.8466034","2024-02-20 21:42:56","ddf",NULL,NULL,NULL,NULL,NULL,NULL,NULL,NULL,NULL,"0.00",NULL,NULL,NULL,NULL,NULL,"2021-10-19",NULL,NULL,"West on Highway 17",NULL,NULL,NULL,NULL,NULL,NULL,NULL,NULL,NULL,NULL,"64500.00",NULL,NULL,"Other","A 125 x 161 ft. vacant commercial lot on Highway 17 on the West side of the city.  All city services are available.  Lot is right next to a small creek with foot bridge.  Large open field is located just behind lot. (id:50029)",NULL,NULL,NULL,NULL,NULL,NULL,"For sale",NULL,NULL,NULL,NULL,NULL,NULL,NULL,"https://www.realtor.ca/real-estate/23748605/275-grand-trunk-ave-dryden-dryden",NULL,NULL,NULL,NULL,NULL,NULL,"0",NULL,NULL,"0",NULL,NULL,NULL,NULL,NULL,NULL,NULL,NULL,NULL,NULL,NULL,NULL,NULL,NULL,NULL,NULL,NULL,NULL,NULL,NULL,NULL,NULL,"False",NULL,NULL,NULL,NULL,NULL,NULL,NULL,NULL,NULL,NULL,NULL,NULL,NULL,"20125.0000",NULL,NULL,NULL,NULL,NULL,NULL,NULL,NULL,NULL,"under 1/2 acre","125.0000",NULL,"false",NULL,NULL,NULL,NULL,NULL,NULL,NULL,NULL,NULL,NULL,NULL,NULL,NULL,NULL,NULL,NULL,NULL,NULL,"275 Grand Trunk AVE","275 Grand Trunk AVE",NULL,NULL,NULL,NULL,NULL,NULL,"dryden","Ontario","P8N2X3","Canada",NULL,"Dryden",NULL,NULL,"[]","[]","[]","[]","[]","0","0"
